{
  "resourceKind": "tool",
  "resourceId": "northstar/example-search-tool",
  "versionId": "0.2.0",
  "implementationRef": "oci://registry.northstar.example/tools/example-search-tool@sha256:9f8e7d6c5b4a3928171605d4e3c2b1a9876543210fedcba9876543210fedcba9",
  "interfaceRef": "https://registry.northstar.example/tools/example-search-tool/interfaces/0.2.0.json",
  "config": {
    "defaultMaxResults": 10,
    "timeoutSeconds": 45,
    "summarizeMaxTokens": 512
  },
  "state": {},
  "metadata": {
    "northstarStage": "preview",
    "displayName": "Example Search Tool",
    "description": "Searches an indexed corpus and returns either ranked snippets (search) or a synthesized summary (summarize).",
    "publisher": "urn:northstar:actor:publisher:tools-team",
    "license": "Apache-2.0",
    "createdAt": "2026-04-29T14:00:00Z",
    "capabilities": ["search", "summarize"],
    "runtimeRequirements": {
      "minMemoryMb": 256,
      "platform": "linux/amd64"
    },
    "contentDigest": "sha256:9f8e7d6c5b4a3928171605d4e3c2b1a9876543210fedcba9876543210fedcba9"
  }
}
